{
  "schemaVersion": "2.0",
  "id": "SCR-030",
  "title": "プロフィール編集画面",
  "type": "screen",
  "status": "draft",
  "commonSpec": "example.common-spec.json",
  "overrides": [
    {
      "rule": "COM-002",
      "behavior": "保存・通信の失敗は画面上部のエラーバナーで表示する",
      "reason": "編集中の入力内容の近くで気づけるよう、この画面はトーストではなくバナーで表示する"
    }
  ],
  "layout": {
    "mockImage": "mocks/SCR-030.png"
  },
  "navigation": {
    "entryPoints": [
      {
        "from": "SCR-001",
        "trigger": "グローバルメニューの「プロフィール編集」を選択"
      }
    ],
    "exitPoints": []
  },
  "states": [
    {
      "name": "読み込み中",
      "initial": true,
      "description": "初期値を取得している。入力欄は表示しない"
    },
    {
      "name": "編集可能",
      "description": "値を表示し、編集・保存できる"
    },
    {
      "name": "保存中",
      "description": "保存処理の完了を待っている。入力欄は編集できない"
    },
    {
      "name": "保存完了",
      "description": "保存に成功し、完了を通知している"
    },
    {
      "name": "競合",
      "description": "他の更新と競合し、最新の取得を促している"
    }
  ],
  "events": [
    {
      "name": "初期値の取得",
      "description": "画面表示時に初期値の取得を試みる"
    },
    {
      "name": "入力値の変更",
      "description": "いずれかの入力欄の値が変わる"
    },
    {
      "name": "保存の実行",
      "description": "保存ボタンを押す"
    },
    {
      "name": "保存結果の受信",
      "description": "保存処理の応答が返る"
    },
    {
      "name": "通知の時間経過",
      "description": "保存完了通知の表示から3秒経過する"
    },
    {
      "name": "最新の取得",
      "description": "競合通知内の取得操作を行う"
    }
  ],
  "elements": [
    {
      "name": "表示名",
      "kind": "テキスト入力",
      "required": true,
      "dataRef": {
        "table": "利用者",
        "column": "表示名"
      },
      "constraints": {
        "minLength": 1,
        "maxLength": 50,
        "blankOnly": false
      },
      "validations": [
        {
          "condition": "未入力または空白のみ",
          "message": "表示名を入力してください"
        },
        {
          "condition": "50文字を超える",
          "message": "表示名は50文字以内で入力してください"
        }
      ],
      "displayByState": {
        "読み込み中": {
          "visibility": "hidden"
        },
        "編集可能": {
          "visibility": "operable"
        },
        "保存中": {
          "visibility": "visible"
        },
        "保存完了": {
          "visibility": "operable"
        },
        "競合": {
          "visibility": "operable"
        }
      }
    },
    {
      "name": "メールアドレス",
      "kind": "テキスト入力",
      "required": true,
      "dataRef": {
        "table": "利用者",
        "column": "メールアドレス"
      },
      "constraints": {
        "maxLength": 254,
        "format": "email"
      },
      "validations": [
        {
          "condition": "未入力",
          "message": "メールアドレスを入力してください"
        },
        {
          "condition": "形式が不正",
          "message": "メールアドレスの形式が正しくありません"
        },
        {
          "condition": "254文字を超える",
          "message": "メールアドレスは254文字以内で入力してください"
        },
        {
          "condition": "他の利用者と重複している",
          "message": "このメールアドレスは既に使用されています"
        }
      ],
      "displayByState": {
        "読み込み中": {
          "visibility": "hidden"
        },
        "編集可能": {
          "visibility": "operable"
        },
        "保存中": {
          "visibility": "visible"
        },
        "保存完了": {
          "visibility": "operable"
        },
        "競合": {
          "visibility": "operable"
        }
      }
    },
    {
      "name": "自己紹介",
      "kind": "テキストエリア",
      "dataRef": {
        "table": "利用者",
        "column": "自己紹介"
      },
      "constraints": {
        "maxLength": 500
      },
      "validations": [
        {
          "condition": "500文字を超える",
          "message": "自己紹介は500文字以内で入力してください"
        }
      ],
      "displayByState": {
        "読み込み中": {
          "visibility": "hidden"
        },
        "編集可能": {
          "visibility": "operable"
        },
        "保存中": {
          "visibility": "visible"
        },
        "保存完了": {
          "visibility": "operable"
        },
        "競合": {
          "visibility": "operable"
        }
      }
    },
    {
      "name": "文字数カウンタ",
      "kind": "表示テキスト",
      "description": "自己紹介の入力文字数を「現在数 / 500」で表示する",
      "displayByState": {
        "読み込み中": {
          "visibility": "hidden"
        },
        "編集可能": {
          "visibility": "visible"
        },
        "保存中": {
          "visibility": "visible"
        },
        "保存完了": {
          "visibility": "visible"
        },
        "競合": {
          "visibility": "visible"
        }
      }
    },
    {
      "name": "保存ボタン",
      "kind": "ボタン",
      "displayByState": {
        "読み込み中": {
          "visibility": "hidden"
        },
        "編集可能": {
          "visibility": "conditional",
          "condition": "入力内容に変更があるときのみ"
        },
        "保存中": {
          "visibility": "visible"
        },
        "保存完了": {
          "visibility": "conditional",
          "condition": "入力内容に変更があるときのみ"
        },
        "競合": {
          "visibility": "conditional",
          "condition": "入力内容に変更があるときのみ"
        }
      }
    },
    {
      "name": "エラーバナー",
      "kind": "バナー",
      "displayByState": {
        "読み込み中": {
          "visibility": "hidden"
        },
        "編集可能": {
          "visibility": "conditional",
          "condition": "保存・通信に失敗したとき"
        },
        "保存中": {
          "visibility": "hidden"
        },
        "保存完了": {
          "visibility": "hidden"
        },
        "競合": {
          "visibility": "hidden"
        }
      }
    },
    {
      "name": "保存完了の通知",
      "kind": "トースト",
      "displayByState": {
        "読み込み中": {
          "visibility": "hidden"
        },
        "編集可能": {
          "visibility": "hidden"
        },
        "保存中": {
          "visibility": "hidden"
        },
        "保存完了": {
          "visibility": "visible"
        },
        "競合": {
          "visibility": "hidden"
        }
      }
    },
    {
      "name": "競合の通知",
      "kind": "バナー",
      "displayByState": {
        "読み込み中": {
          "visibility": "hidden"
        },
        "編集可能": {
          "visibility": "hidden"
        },
        "保存中": {
          "visibility": "hidden"
        },
        "保存完了": {
          "visibility": "hidden"
        },
        "競合": {
          "visibility": "visible"
        }
      },
      "children": [
        {
          "name": "競合メッセージ",
          "kind": "表示テキスト",
          "displayByState": {
            "読み込み中": {
              "visibility": "hidden"
            },
            "編集可能": {
              "visibility": "hidden"
            },
            "保存中": {
              "visibility": "hidden"
            },
            "保存完了": {
              "visibility": "hidden"
            },
            "競合": {
              "visibility": "visible"
            }
          }
        },
        {
          "name": "最新を取得ボタン",
          "kind": "ボタン",
          "displayByState": {
            "読み込み中": {
              "visibility": "hidden"
            },
            "編集可能": {
              "visibility": "hidden"
            },
            "保存中": {
              "visibility": "hidden"
            },
            "保存完了": {
              "visibility": "hidden"
            },
            "競合": {
              "visibility": "operable"
            }
          }
        }
      ]
    }
  ],
  "behaviorMatrix": [
    {
      "state": "読み込み中",
      "on": [
        {
          "event": "初期値の取得",
          "branches": [
            {
              "case": "成功",
              "process": "取得した値を各入力欄に表示する",
              "to": "編集可能"
            },
            {
              "case": "失敗",
              "undefined": true
            }
          ]
        },
        {
          "event": "入力値の変更",
          "notApplicable": {
            "reason": "この状態では入力欄が非表示のため発生しない"
          }
        },
        {
          "event": "保存の実行",
          "notApplicable": {
            "reason": "この状態では保存ボタンが非表示のため発生しない"
          }
        },
        {
          "event": "保存結果の受信",
          "notApplicable": {
            "reason": "保存処理が開始されていないため発生しない"
          }
        },
        {
          "event": "通知の時間経過",
          "notApplicable": {
            "reason": "保存完了の通知が表示されていないため発生しない"
          }
        },
        {
          "event": "最新の取得",
          "notApplicable": {
            "reason": "競合の通知が非表示のため発生しない"
          }
        }
      ]
    },
    {
      "state": "編集可能",
      "on": [
        {
          "event": "初期値の取得",
          "notApplicable": {
            "reason": "初期値の取得は画面表示時（読み込み中）にのみ行われるため発生しない"
          }
        },
        {
          "event": "入力値の変更",
          "process": "変更の有無に応じて保存ボタンの操作可否を更新する",
          "to": "編集可能",
          "source": {
            "element": "表示名"
          }
        },
        {
          "event": "保存の実行",
          "branches": [
            {
              "case": "入力検証エラーあり",
              "process": "該当要素にエラーを表示し、状態を変えない",
              "to": "編集可能"
            },
            {
              "case": "入力検証エラーなし",
              "process": "保存処理を開始する",
              "to": "保存中"
            }
          ],
          "source": {
            "element": "保存ボタン"
          }
        },
        {
          "event": "保存結果の受信",
          "notApplicable": {
            "reason": "保存処理が開始されていないため発生しない"
          }
        },
        {
          "event": "通知の時間経過",
          "notApplicable": {
            "reason": "保存完了の通知が表示されていないため発生しない"
          }
        },
        {
          "event": "最新の取得",
          "notApplicable": {
            "reason": "競合の通知が非表示のため発生しない"
          }
        }
      ]
    },
    {
      "state": "保存中",
      "on": [
        {
          "event": "初期値の取得",
          "notApplicable": {
            "reason": "初期値の取得は画面表示時（読み込み中）にのみ行われるため発生しない"
          }
        },
        {
          "event": "入力値の変更",
          "notApplicable": {
            "reason": "この状態では入力欄が表示のみで編集できないため発生しない"
          }
        },
        {
          "event": "保存の実行",
          "notApplicable": {
            "reason": "この状態では保存ボタンが表示のみで押せないため発生しない（二重送信の防止）"
          }